{
  "version":{
    "sugar": 1
  },
  "notes": "These parameters are temporary",
  "include":[
    "elba-sugar/glucose.json"
  ],
  "molecules":{
    "MEO":{
      "atoms":[
        {"name": "C",  "type": "MEOH"}
      ]
    },
    "ETO":{
      "atoms":[
        {"name": "C",  "type": "ETOH"}
      ]
    }
  }
}